{
  "schema_version": "1.0",
  "environment": "RESEARCH",
  "inherits": "config/base.json",
  "config_version": 1,
  "provisioning_state": "CONTRACT_ONLY",
  "authority_ceiling": "SIMULATED_ONLY",
  "safety": {
    "live_trading": false,
    "auto_trading": false,
    "withdrawals": false,
    "transfers": false
  },
  "execution": {
    "active_mode": "DISABLED",
    "external_order_submission": false
  },
  "credentials": {
    "authority_provisioned": false,
    "secret_namespace": "secret://research/",
    "secret_refs": {}
  },
  "settings": {
    "log_level": "INFO",
    "clock_mode": "REPLAY",
    "data_mode": "RECORDED"
  }
}
